<?xml version="1.0" encoding="UTF-8"?>
<xs:schema xmlns:xs="http://www.w3.org/2001/XMLSchema" elementFormDefault="qualified">
    <xs:element name="vehiculos">
        <xs:complexType>
            <xs:sequence>
                <xs:element name="vehiculo" minOccurs="1" maxOccurs="unbounded">
                    <xs:complexType>
                        <xs:sequence>
                            <xs:element name="nombre" type="xs:string" minOccurs="1" maxOccurs="unbounded"/>
                            <xs:element name="modelo" type="xs:string"/>
                            <xs:element name="fabricacion" minOccurs="1" maxOccurs="1">
                                <xs:complexType>
                                    <xs:sequence>
                                        <xs:element name="inicio" minOccurs="1" maxOccurs="1">
                                            <xs:complexType>
                                                <xs:sequence>
                                                    <xs:element name="dia" minOccurs="1" maxOccurs="1"/>
                                                    <xs:element name="mes" minOccurs="1" maxOccurs="1"/>
                                                    <xs:element name="año" minOccurs="1" maxOccurs="1"/>
                                                </xs:sequence>
                                            </xs:complexType>
                                        </xs:element>
                                        <xs:element name="fin" minOccurs="1" maxOccurs="1">
                                            <xs:complexType>
                                                <xs:sequence>
                                                    <xs:element name="dia" minOccurs="1" maxOccurs="1"/>
                                                    <xs:element name="mes" minOccurs="1" maxOccurs="1"/>
                                                    <xs:element name="año" minOccurs="1" maxOccurs="1"/>
                                                </xs:sequence>
                                            </xs:complexType>
                                        </xs:element>
                                    </xs:sequence>
                                </xs:complexType>
                            </xs:element>
                            <xs:element name="modificaciones" minOccurs="1" maxOccurs="1">
                                <xs:complexType>
                                    <xs:sequence>
                                        <xs:element name="modificacion" type="xs:string" minOccurs="1" maxOccurs="unbounded"/>
                                    </xs:sequence>
                                </xs:complexType>
                            </xs:element>
                        </xs:sequence>
                    </xs:complexType>
                </xs:element>
            </xs:sequence>
        </xs:complexType>
    </xs:element>
</xs:schema>
