<?xml version="1.0" encoding="UTF-8"?>


<vehiculos xmlns:xsi ="http://www.w3.org/2001/XMLSchema-instance" xsi:noNamespaceSchemaLocation="vehiculos.xsd">
    <vehiculo>
        <nombre>Count Zero</nombre>
        <modelo>Series I, 80"</modelo>
        <fabricacion>
            <inicio>
                <dia>21</dia>
                <mes>July</mes>
                <a単o>1949</a単o>
            </inicio>
            <fin>
                <dia>9</dia>
                <mes>August</mes>
                <a単o>1949</a単o>
            </fin>
        </fabricacion>
        <modificaciones>
        <modificacion>Change Engine</modificacion>
        <modificacion>Change pedals</modificacion>
        <modificacion>Change gearbox</modificacion>
        <modificacion>Fit Rollcage</modificacion>
        </modificaciones>
    </vehiculo>
</vehiculos>